{
  "$schema": "https://json-schema.org/draft/2020-12/schema",
  "$id": "https://gnustep.example/schemas/toolchain-component-inventory-v1.schema.json",
  "title": "GNUstep Managed Toolchain Component Inventory v1",
  "type": "object",
  "required": [
    "schema_version",
    "target",
    "toolchain_version",
    "components"
  ],
  "properties": {
    "schema_version": {
      "const": 1
    },
    "target": {
      "type": "object",
      "required": [
        "id",
        "os",
        "arch",
        "compiler_family",
        "toolchain_flavor"
      ],
      "additionalProperties": true
    },
    "toolchain_version": {
      "type": "string"
    },
    "components": {
      "type": "array",
      "items": {
        "type": "object",
        "required": [
          "name",
          "version",
          "source"
        ],
        "properties": {
          "name": {
            "type": "string"
          },
          "version": {
            "type": "string"
          },
          "source": {
            "type": "string"
          }
        },
        "additionalProperties": true
      }
    }
  },
  "additionalProperties": true
}
